{
  "type": "object",
  "required": [
    "model_id",
    "instance_count_min",
    "review_basis",
    "expected_instances",
    "optional_absent_fields"
  ],
  "additionalProperties": false,
  "properties": {
    "model_id": {
      "const": "postgresql"
    },
    "instance_count_min": {
      "type": "integer"
    },
    "review_basis": {
      "type": "string"
    },
    "expected_instances": {
      "type": "array",
      "minItems": 1,
      "maxItems": 1,
      "prefixItems": [
        {
          "type": "object",
          "required": [
            "inst_name",
            "ip_addr",
            "port",
            "version",
            "config",
            "data_path",
            "max_connect",
            "shared_buffer",
            "log_directory"
          ],
          "additionalProperties": false,
          "properties": {
            "inst_name": {
              "type": "string"
            },
            "ip_addr": {
              "type": "string"
            },
            "port": {
              "type": "string"
            },
            "version": {
              "type": "string"
            },
            "config": {
              "type": "string"
            },
            "data_path": {
              "type": "string"
            },
            "max_connect": {
              "type": "string"
            },
            "shared_buffer": {
              "type": "string"
            },
            "log_directory": {
              "type": "string"
            }
          }
        }
      ],
      "items": false
    },
    "optional_absent_fields": {
      "type": "array",
      "maxItems": 0
    }
  },
  "$schema": "https://json-schema.org/draft/2020-12/schema"
}
